[
  { "id": "off-greet-l1", "scenario": "off-greeting", "difficulty": "L1", "prompt": "hi", "route": "off", "complex": false, "scope": "no_engineering", "live": true },
  { "id": "off-greet-l2", "scenario": "off-greeting", "difficulty": "L2", "prompt": "你好！", "route": "off", "complex": false, "scope": "no_engineering", "live": false },
  { "id": "off-greet-l3", "scenario": "off-greeting", "difficulty": "L3", "prompt": "good morning, thanks for your help today", "route": "off", "complex": false, "scope": "no_engineering", "live": false },
  { "id": "off-greet-l4", "scenario": "off-greeting", "difficulty": "L4", "prompt": "在吗？我想先打个招呼，没有别的事。", "route": "off", "complex": false, "scope": "no_engineering", "live": false },
  { "id": "off-neutral-l1", "scenario": "off-neutral", "difficulty": "L1", "prompt": "今天天气不错", "route": "off", "complex": false, "scope": "no_engineering", "live": true },
  { "id": "off-neutral-l2", "scenario": "off-neutral", "difficulty": "L2", "prompt": "谢谢你的帮助。", "route": "off", "complex": false, "scope": "no_engineering", "live": false },
  { "id": "off-neutral-l3", "scenario": "off-neutral", "difficulty": "L3", "prompt": "tell me something interesting about history", "route": "off", "complex": false, "scope": "no_engineering", "live": false },
  { "id": "off-neutral-l4", "scenario": "off-neutral", "difficulty": "L4", "prompt": "今天股票怎么样？随便聊聊就行。", "route": "off", "complex": false, "scope": "no_engineering", "live": false },
  { "id": "plan-explicit-l1", "scenario": "plan-explicit", "difficulty": "L1", "prompt": "just make a plan", "route": "plan", "complex": true, "scope": "read_only", "live": true },
  { "id": "plan-explicit-l2", "scenario": "plan-explicit", "difficulty": "L2", "prompt": "只做实施方案，不要修改文件。", "route": "plan", "complex": true, "scope": "read_only", "live": true },
  { "id": "plan-explicit-l3", "scenario": "plan-explicit", "difficulty": "L3", "prompt": "please give me a technical plan for the migration, do not touch any files yet", "route": "plan", "complex": true, "scope": "read_only", "live": false },
  { "id": "plan-explicit-l4", "scenario": "plan-explicit", "difficulty": "L4", "prompt": "制定一个跨组件的实施方案：先规划数据迁移的依赖顺序、兼容策略与回滚边界，不要实现或修改任何代码。", "route": "plan", "complex": true, "scope": "read_only", "live": true },
  { "id": "plan-permission-l1", "scenario": "plan-permission", "difficulty": "L1", "prompt": "实现一个缓存层", "permission_mode": "plan", "route": "plan", "complex": true, "scope": "read_only", "live": true },
  { "id": "plan-permission-l2", "scenario": "plan-permission", "difficulty": "L2", "prompt": "修复这个模块并增加测试", "permission_mode": "plan", "route": "plan", "complex": true, "scope": "read_only", "live": false },
  { "id": "plan-permission-l3", "scenario": "plan-permission", "difficulty": "L3", "prompt": "refactor the whole service and migrate it", "permission_mode": "plan", "route": "plan", "complex": true, "scope": "read_only", "live": false },
  { "id": "plan-permission-l4", "scenario": "plan-permission", "difficulty": "L4", "prompt": "为这个分布式系统设计高可用方案并给出实施步骤，只做方案。", "permission_mode": "plan", "route": "plan", "complex": true, "scope": "read_only", "live": false },
  { "id": "inspect-explain-l1", "scenario": "inspect-explain", "difficulty": "L1", "prompt": "explain this function", "route": "inspect", "complex": false, "scope": "read_only", "live": true },
  { "id": "inspect-explain-l2", "scenario": "inspect-explain", "difficulty": "L2", "prompt": "解释一下这段认证逻辑是怎么工作的。", "route": "inspect", "complex": false, "scope": "read_only", "live": false },
  { "id": "inspect-explain-l3", "scenario": "inspect-explain", "difficulty": "L3", "prompt": "explain the concurrency model of this system and its edge cases", "route": "inspect", "complex": true, "scope": "read_only", "live": true },
  { "id": "inspect-explain-l4", "scenario": "inspect-explain", "difficulty": "L4", "prompt": "请分析这个跨组件集成方案的安全边界与兼容性风险，并解释每个决策的取舍，不要改代码。", "route": "inspect", "complex": true, "scope": "read_only", "live": false },
  { "id": "inspect-diagnose-l1", "scenario": "inspect-diagnose", "difficulty": "L1", "prompt": "diagnose this error", "route": "inspect", "complex": false, "scope": "read_only", "live": true },
  { "id": "inspect-diagnose-l2", "scenario": "inspect-diagnose", "difficulty": "L2", "prompt": "诊断登录报错并告诉我根因。", "route": "inspect", "complex": false, "scope": "read_only", "live": false },
  { "id": "inspect-diagnose-l3", "scenario": "inspect-diagnose", "difficulty": "L3", "prompt": "investigate the timeout failure and reproduce it, then report the root cause", "route": "inspect", "complex": false, "scope": "read_only", "live": true },
  { "id": "inspect-diagnose-l4", "scenario": "inspect-diagnose", "difficulty": "L4", "prompt": "定位并发场景下的数据不一致问题：先复现、再核对事务边界与回滚行为，只报告证据和可能原因，不要修复。", "route": "inspect", "complex": true, "scope": "read_only", "live": false },
  { "id": "inspect-status-l1", "scenario": "inspect-status", "difficulty": "L1", "prompt": "check the test status", "route": "inspect", "complex": false, "scope": "read_only", "live": true },
  { "id": "inspect-status-l2", "scenario": "inspect-status", "difficulty": "L2", "prompt": "查看测试状态并总结失败项。", "route": "inspect", "complex": false, "scope": "read_only", "live": false },
  { "id": "inspect-status-l3", "scenario": "inspect-status", "difficulty": "L3", "prompt": "evaluate the current performance of the service and summarize bottlenecks", "route": "inspect", "complex": true, "scope": "read_only", "live": true },
  { "id": "inspect-status-l4", "scenario": "inspect-status", "difficulty": "L4", "prompt": "请评估这套系统的兼容性现状：核对各组件版本、跨版本边界情况与回归记录，汇总成一份状态报告，不改动任何配置。", "route": "inspect", "complex": true, "scope": "read_only", "live": false },
  { "id": "fix-defect-l1", "scenario": "fix-defect", "difficulty": "L1", "prompt": "fix the failing test", "route": "fix", "complex": false, "scope": "change", "live": true },
  { "id": "fix-defect-l2", "scenario": "fix-defect", "difficulty": "L2", "prompt": "修复登录失败并运行回归测试。", "route": "fix", "complex": true, "scope": "change", "live": false },
  { "id": "fix-defect-l3", "scenario": "fix-defect", "difficulty": "L3", "prompt": "fix the regression in the payment module and verify the fix", "route": "fix", "complex": true, "scope": "change", "live": true },
  { "id": "fix-defect-l4", "scenario": "fix-defect", "difficulty": "L4", "prompt": "修复这个模块的回归缺陷：先复现失败、定位根因，再应用最小修复并运行完整回归测试，最后给出验证结论。", "route": "fix", "complex": true, "scope": "change", "live": false },
  { "id": "fix-timeout-l1", "scenario": "fix-timeout-crash", "difficulty": "L1", "prompt": "fix the timeout", "route": "fix", "complex": false, "scope": "change", "live": true },
  { "id": "fix-timeout-l2", "scenario": "fix-timeout-crash", "difficulty": "L2", "prompt": "修复接口超时问题并增加超时重试。", "route": "fix", "complex": false, "scope": "change", "live": false },
  { "id": "fix-timeout-l3", "scenario": "fix-timeout-crash", "difficulty": "L3", "prompt": "fix the crash and the memory leak in the worker process", "route": "fix", "complex": false, "scope": "change", "live": true },
  { "id": "fix-timeout-l4", "scenario": "fix-timeout-crash", "difficulty": "L4", "prompt": "修复分布式环境下客户端闪退与连接卡死的问题：先复现，再检查并发与连接池边界情况，应用最小修复并验证。", "route": "fix", "complex": true, "scope": "change", "live": false },
  { "id": "fix-security-l1", "scenario": "fix-security", "difficulty": "L1", "prompt": "fix the vulnerability", "route": "fix", "complex": true, "scope": "change", "live": true },
  { "id": "fix-security-l2", "scenario": "fix-security", "difficulty": "L2", "prompt": "修复路径穿越漏洞并增加回归测试。", "route": "fix", "complex": true, "scope": "change", "live": false },
  { "id": "fix-security-l3", "scenario": "fix-security", "difficulty": "L3", "prompt": "fix the security issue in authentication and verify the fix", "route": "fix", "complex": true, "scope": "change", "live": true },
  { "id": "fix-security-l4", "scenario": "fix-security", "difficulty": "L4", "prompt": "修复认证模块的权限绕过漏洞：先复现攻击路径，检查安全边界与兼容性影响，应用最小修复并运行完整回归。", "route": "fix", "complex": true, "scope": "change", "live": false },
  { "id": "build-feature-l1", "scenario": "build-feature", "difficulty": "L1", "prompt": "implement a health check endpoint", "route": "build", "complex": false, "scope": "change", "live": true },
  { "id": "build-feature-l2", "scenario": "build-feature", "difficulty": "L2", "prompt": "实现一个健康检查端点并测试。", "route": "build", "complex": false, "scope": "change", "live": false },
  { "id": "build-feature-l3", "scenario": "build-feature", "difficulty": "L3", "prompt": "create a scalable configuration service with retry and validation", "route": "build", "complex": true, "scope": "change", "live": true },
  { "id": "build-feature-l4", "scenario": "build-feature", "difficulty": "L4", "prompt": "构建一个支持并发读写与边界情况校验的配置中心：先设计接口与存储结构，再实现、集成并完成兼容性验证。", "route": "build", "complex": true, "scope": "change", "live": false },
  { "id": "build-migrate-l1", "scenario": "build-migrate-deploy", "difficulty": "L1", "prompt": "migrate the config format", "route": "build", "complex": true, "scope": "change", "live": true },
  { "id": "build-migrate-l2", "scenario": "build-migrate-deploy", "difficulty": "L2", "prompt": "迁移配置格式并保留向后兼容。", "route": "build", "complex": true, "scope": "change", "live": false },
  { "id": "build-migrate-l3", "scenario": "build-migrate-deploy", "difficulty": "L3", "prompt": "deploy the service to production and publish the release notes", "route": "build", "complex": false, "scope": "change", "live": true },
  { "id": "build-migrate-l4", "scenario": "build-migrate-deploy", "difficulty": "L4", "prompt": "把现有单体拆分为可独立部署的服务：先做架构迁移方案，再实施拆分、适配调用方并验证跨组件集成与兼容性。", "route": "build", "complex": true, "scope": "change", "live": false },
  { "id": "build-write-l1", "scenario": "build-write", "difficulty": "L1", "prompt": "write a readme", "route": "build", "complex": false, "scope": "change", "live": true },